{
  "campaign_id": "C-45488bdaf5",
  "program": "VerifyP1Cross",
  "created_at": "2026-09-09T12:00:01.000000+00:00",
  "updated_at": "2026-09-09T12:00:41.000000+00:00",
  "phase": "DISCOVERY",
  "phase_history": [
    {
      "at": "2026-09-09T12:00:03.000000+00:00",
      "from": "SCOPE",
      "to": "DISCOVERY",
      "reason": "plan ready"
    }
  ],
  "halt_reason": null,
  "budget": {
    "max_discovery_findings": 400,
    "max_repro_attempts_per_finding": 6,
    "max_fresh_context_retries": 3,
    "max_passes": 8,
    "pass": 1,
    "discovery_findings_so_far": 2
  },
  "snapshots": [
    {
      "snapshot_id": "src-1684fd7b-b868c7cd06e0",
      "pass": 1,
      "pinned": true,
      "registered_at": "2026-09-09T12:00:35.000000+00:00"
    }
  ],
  "active_snapshot_id": "src-1684fd7b-b868c7cd06e0",
  "artifacts": [
    {
      "artifact_id": "PRO-8a7fd208",
      "kind": "protocol-model",
      "path": "campaigns/C-45488bdaf5/artifacts/protocol_model.json",
      "registered_at": "2026-09-09T12:00:02.000000+00:00",
      "sha256": "fc2f548bb15b7bbf8ac4c2a01115921d63e32978f7ff3baa8693e44f1d653d12",
      "snapshot_id": null,
      "note": "protocol model for Verify P1 Fixture",
      "refreshed_at": "2026-09-09T12:00:02.000000+00:00",
      "refresh_reason": "protocol model (re)loaded",
      "refresh_count": 1
    },
    {
      "artifact_id": "PLA-f43186bb",
      "kind": "plan",
      "path": "campaigns/C-45488bdaf5/artifacts/campaign_plan.json",
      "registered_at": "2026-09-09T12:00:03.000000+00:00",
      "sha256": "4102b8f12c6f5d7ef50090f6ac460db17a461b5204f3cf6b01a0e4f5fdd8d97e",
      "snapshot_id": null,
      "note": "campaign plan, 7 priorities",
      "refreshed_at": "2026-09-09T12:00:40.000000+00:00",
      "refresh_reason": "plan saved (7 priorities)",
      "refresh_count": 2
    },
    {
      "artifact_id": "REP-adc3248d",
      "kind": "report",
      "path": "/home/xand/Projects/dsh-plugins/websec2/web3sec-go/.scratch/verify-p1/fixtures/note.md",
      "registered_at": "2026-09-09T12:00:10.000000+00:00",
      "sha256": "771036afe171e7fefee4f5539663d88c4cfc01c12c185b863634da70c667e6d7",
      "snapshot_id": null,
      "note": ""
    },
    {
      "artifact_id": "REP-37b22d0d",
      "kind": "report",
      "path": "campaigns/C-45488bdaf5/report.md",
      "registered_at": "2026-09-09T12:00:34.000000+00:00",
      "sha256": "6c93533b07c657e6907d9210fb19ec94013cc275ae33735154c2c3c75f1c4eb9",
      "snapshot_id": null,
      "note": ""
    },
    {
      "artifact_id": "VAL-2571d3b4",
      "kind": "value-flow",
      "path": "campaigns/C-45488bdaf5/artifacts/value_flow.json",
      "registered_at": "2026-09-09T12:00:37.000000+00:00",
      "sha256": "758e9a65f59b5a7df45dc9f9e41be5d94d596d4966abec0c1fb1d2bd7d0ddf3f",
      "snapshot_id": null,
      "note": ""
    },
    {
      "artifact_id": "ARC-7984d47d",
      "kind": "archetype-prescreen",
      "path": "campaigns/C-45488bdaf5/artifacts/archetype_prescreen.json",
      "registered_at": "2026-09-09T12:00:38.000000+00:00",
      "sha256": "a33e7844444da541b60f6107f3e11b1284020dda28e09a90b9581c46dcf1f727",
      "snapshot_id": null,
      "note": ""
    },
    {
      "artifact_id": "PRO-0553f4cc",
      "kind": "probe-surface",
      "path": "campaigns/C-45488bdaf5/artifacts/probe_surface.json",
      "registered_at": "2026-09-09T12:00:39.000000+00:00",
      "sha256": "3bb38ddd3324e86c46077febd4c3530f1170b514de79b745f385cbc6b850195c",
      "snapshot_id": null,
      "note": "",
      "refreshed_at": "2026-09-09T12:00:40.000000+00:00",
      "refresh_reason": "0 rows across 6 axes",
      "refresh_count": 1
    }
  ],
  "stages": {
    "protocol-model": {
      "status": "needs-model",
      "attempts": 1,
      "last_run_at": "2026-09-09T12:00:02.000000+00:00",
      "note": "model loaded; 2 invariant(s) seeded",
      "executor": null
    },
    "campaign-planning": {
      "status": "needs-model",
      "attempts": 1,
      "last_run_at": "2026-09-09T12:00:03.000000+00:00",
      "note": "7 queued priorities",
      "executor": null
    },
    "discovery-specialist": {
      "status": "needs-model",
      "attempts": 2,
      "last_run_at": "2026-09-09T12:00:06.000000+00:00",
      "note": "ingested F-ee0311c3397a",
      "executor": null
    }
  },
  "events": [
    {
      "seq": 0,
      "at": "2026-09-09T12:00:01.000000+00:00",
      "type": "campaign.created",
      "ref": "C-45488bdaf5",
      "data": {
        "program": "VerifyP1Cross"
      },
      "prev_hash": "0000000000000000000000000000000000000000000000000000000000000000",
      "event_hash": "4dfd857249f398300cda1915e8152d1b65b1714b129a17df341b59a5fdc60f18"
    },
    {
      "seq": 1,
      "at": "2026-09-09T12:00:02.000000+00:00",
      "type": "artifact.registered",
      "ref": "PRO-8a7fd208",
      "data": {
        "kind": "protocol-model",
        "path": "/home/xand/Projects/dsh-plugins/websec2/web3sec-go/.scratch/verify-p1/pyroot/campaigns/C-45488bdaf5/artifacts/protocol_model.json"
      },
      "prev_hash": "4dfd857249f398300cda1915e8152d1b65b1714b129a17df341b59a5fdc60f18",
      "event_hash": "ba10b86a29995a0bed8d61b3a0f04473460d8054c1875639c1beffea86b92123"
    },
    {
      "seq": 2,
      "at": "2026-09-09T12:00:02.000000+00:00",
      "type": "artifact.refreshed",
      "ref": "PRO-8a7fd208",
      "data": {
        "kind": "protocol-model",
        "actor": "operator",
        "reason": "protocol model (re)loaded",
        "old_sha256": "fc2f548bb15b7bbf8ac4c2a01115921d63e32978f7ff3baa8693e44f1d653d12",
        "new_sha256": "fc2f548bb15b7bbf8ac4c2a01115921d63e32978f7ff3baa8693e44f1d653d12",
        "refresh_count": 1
      },
      "prev_hash": "ba10b86a29995a0bed8d61b3a0f04473460d8054c1875639c1beffea86b92123",
      "event_hash": "7ea05f09f953ef14ab1415bc5b4db6dade9fec71fc2e9ffe090fdf7859930c0c"
    },
    {
      "seq": 3,
      "at": "2026-09-09T12:00:02.000000+00:00",
      "type": "protocol_model.loaded",
      "ref": "v1xfi",
      "data": {
        "contracts": 1,
        "invariants": 2
      },
      "prev_hash": "7ea05f09f953ef14ab1415bc5b4db6dade9fec71fc2e9ffe090fdf7859930c0c",
      "event_hash": "af6eb868a01ca42429f2e8095ecb43ca698d5611b88534e7671b793651ed73fa"
    },
    {
      "seq": 4,
      "at": "2026-09-09T12:00:02.000000+00:00",
      "type": "invariants.seeded",
      "ref": null,
      "data": {
        "count": 2
      },
      "prev_hash": "af6eb868a01ca42429f2e8095ecb43ca698d5611b88534e7671b793651ed73fa",
      "event_hash": "2b04fd4023de84b957514d0c25cd7708fa56eb2e21b1315c65843f7d6eefd43c"
    },
    {
      "seq": 5,
      "at": "2026-09-09T12:00:02.000000+00:00",
      "type": "invariants.reconciled",
      "ref": null,
      "data": {
        "documented": [],
        "missing_from_model": [],
        "extra_in_model": [
          "INV-1",
          "INV-2"
        ]
      },
      "prev_hash": "2b04fd4023de84b957514d0c25cd7708fa56eb2e21b1315c65843f7d6eefd43c",
      "event_hash": "ffd9ae500ef0891bdaa2349ff293409452c3d40462a36b7d48833fc6b0e48dcb"
    },
    {
      "seq": 6,
      "at": "2026-09-09T12:00:03.000000+00:00",
      "type": "artifact.registered",
      "ref": "PLA-f43186bb",
      "data": {
        "kind": "plan",
        "path": "/home/xand/Projects/dsh-plugins/websec2/web3sec-go/.scratch/verify-p1/pyroot/campaigns/C-45488bdaf5/artifacts/campaign_plan.json"
      },
      "prev_hash": "ffd9ae500ef0891bdaa2349ff293409452c3d40462a36b7d48833fc6b0e48dcb",
      "event_hash": "720f9adeae0dedd239016e984cf618dfe64d348618fbbc5aeef93c9c3f9f5790"
    },
    {
      "seq": 7,
      "at": "2026-09-09T12:00:03.000000+00:00",
      "type": "plan.reachability",
      "ref": null,
      "data": {
        "e5": [
          "no deployment/chain pin on the active snapshot — fork evidence (E5+) has no fork target, for single-call PoCs and multi-tx sequence PoCs (`webv2 sequence run`) alike; pin one (`webv2 snap`) or record a floor override (`webv2 floors set`)",
          "FORK_RPC_URL is not set — the fork-runner profile cannot reach a chain"
        ],
        "e6": [
          "no deployment/chain pin on the active snapshot — fork evidence (E5+) has no fork target, for single-call PoCs and multi-tx sequence PoCs (`webv2 sequence run`) alike; pin one (`webv2 snap`) or record a floor override (`webv2 floors set`)",
          "no chain pin on the active snapshot — cross-chain witnesses (E6) need one",
          "FORK_RPC_URL is not set — the fork-runner profile cannot reach a chain"
        ],
        "classes_at_e5_plus": {
          "oracle-manipulation": "E5",
          "flash-loan": "E5",
          "share-price-inflation": "E6",
          "economic-invariant": "E6",
          "liquidation-logic": "E5",
          "bridge-message": "E6",
          "cross-chain-replay": "E6"
        }
      },
      "prev_hash": "720f9adeae0dedd239016e984cf618dfe64d348618fbbc5aeef93c9c3f9f5790",
      "event_hash": "a88517643edcdd61d6e14783405f8fa8dcb4eead34644a29549a50dd8c8df088"
    },
    {
      "seq": 8,
      "at": "2026-09-09T12:00:03.000000+00:00",
      "type": "phase.transition",
      "ref": "DISCOVERY",
      "data": {
        "from": "SCOPE",
        "reason": "plan ready"
      },
      "prev_hash": "a88517643edcdd61d6e14783405f8fa8dcb4eead34644a29549a50dd8c8df088",
      "event_hash": "35d8c10054442a22d693f1628896d0f838119982512561f7105696ef301350a0"
    },
    {
      "seq": 9,
      "at": "2026-09-09T12:00:04.000000+00:00",
      "type": "finding.ingested",
      "ref": "F-df01bb454ed5",
      "data": {
        "trajectory": "code",
        "stage": "verify-p1",
        "model": null,
        "bug_class": "logic-error",
        "class_advisory": null,
        "intake_warnings": []
      },
      "prev_hash": "35d8c10054442a22d693f1628896d0f838119982512561f7105696ef301350a0",
      "event_hash": "1c52724e59244e62c0c38aac91e02aade711cba93f40a8272899915cafa5e0ce"
    },
    {
      "seq": 10,